text,label
"@MartaRiveraCruz @SufridoresMetro @maucarlo1 @alicia_rdepaz un aporte curioso,los que viajamos en metro pagamos impuestos también #sorpresa",5
vaya puta mierda!! tengo centimetro y medio de rotuta.. no puedo tener tan mala suerte en esta vida. #UNDIDO #ASCO #SUPUTAMADRE,4
Definitivamente hay que aprovechar las oportunidades que da la vida en el mismo instante en que se presentan. #Feliz,3
espero no volvr a ver 1 partido en @tdn_twit d Italia dond llamen viejo al portero y el delantero da miedo si lo ves en 1 callejon #malgusto,0
"Ahir l'#euro va tocar l’1,1470, el seu mínim des del 2003 i molt per sota del valor del seu naixement, el gener del 1999 (1,1747) #sorpresa",5
ayer en el teatro para una de los mejores monólogos cristianos que he escuchado #feliz ❤️❤️,3
Despues de unas dos oras esto sigue si sonar del todo bien #asco #joder necesito un pie nuevo!!! http://t.co/7I3mW5y6xe,4
"Loco yo no festejo miralo a Francia, Holanda, Alemania 5, 4 goles y nosotros 1 gol contra irán dejate de joder #AndateSabella #Bronca",0
"@DoctorePoLLo sigue con la varita magica en su espalda, es imposible que en un pack opening no saque un 50% de beneficio... #INCREIBLE",5
Mañana me dan los resultados de mis análisis de la bacteria y muchas más cosas que saldrán :( #MeMuero #Limpienme #Nervios #Miedo,1
"#MeCaeMal esa gente que se Cree que se sabe la Vida de todos y que Siempre quiera tener la Razon en todo

AGUANTA LOCO!",0
Hay perfumes que me gustan y luego está este.. Este perfume ME PONE :$ #Regalito#Sorpresa http://t.co/jSULFZhXED,5
Nadie quiere echar unaa canastas conmigo -_- #asco,4
#IMPACTATE Familia de seis dedos quiere ser el amuleto de Brasil en este Mundial (Fotos + Video) http://t.co/MTYZ7B1bqb,5
"Recordando la conversación de unos neofitos sobre los temblores,#dicen que será más fuerte q el del 85 ahh #terror en las alturas, ja :S",1
Sin duda en el mejor fin de curso que he visto EN MI VIDA. #Increible #mencanta,5
"En la vida, lo que a veces parece un final, realmente es un nuevo comienzo.
#Me #Sonrisa #Feliz… http://t.co/FPRbglrWH3",3
Espero que la liga no se la lleve un equipo en el que siquiera se puede llevar una bandera de ESPAÑA y lucirla  ! #Asco#Vergüenza#Guarros,4
#SORPRESA no fue uno! La semana pasada desertaron 8 oficiales de Casa Militar. Tenientes y Capitanes del 1º y 2º anillo de Maduro,5
"@OIZuluaga ayer se quejaba de @JuanManSantos por faltar a debate de @Cablenoticias,no lo veo a ud en el de @CanalCapital. #miedo #vergüenza?",1
Gracias a las chicas de @MakeupNord y Al Vestidor de Valentina por haberme tratado esta mañana como una reina 😊 #feliz #ucovi,3
@aytodebadajoz maltrata a los animales de la perrera y se beneficia económicamente del trabajo de los voluntarios de @SosPerreraBdjz #asco,4
Puta mierda de país en el q si tienes un trabajo de mierda te dicen q des gracias q tienes suerte y ahora no dejan ni dar tu opinión #asco,4
"Pido precios sobre algo infantil y me manda catalogo con lo q hacen, #Increible Ezequiel con “S”!!Listo,desp.te aviso http://t.co/ep6POzzOKz",5
#NadaMasFeoQue las minas que se clavan los pantalones de la escuela en el orto #AhListoQueVillero,0
#NadaMasFeoQue la propaganda de Multi O jajajajajjaa te hace poner re incomodo cuando estas cn tu vieja y justo pasan eso jajajaja,0
A dormir y mañana (o en unas pocas horillas) más! Que hay clases de 9-11 y de 13:30 a 15:30! Y si todo va bien 3 sesiones de entreno #Miedo,1
"Dime con quien andas y te diré quien eres...Anda sola, nadie la quiere es una basura que habla pestes del resto, ni te me cruces... #Asco",4
#NadaMasFeoQue te estes mirando en la ventana de un coche y al cabo de un rato te des cuenta de que hay alguien dentro. :$,0
"Me encanta  ver Charlie y la fábrica de chocolate, hasta que empiezan a cantar #OdioLosMusicales",0
"No habría que cacarear tanto cuando descubren petróleo, anda a saber lo que estarán pensando en la oficina oval #Miedo",1
"#NadaMasFeoQue tener ganas de comer algo ,y que ya no halla nada abierto ! :(",0
Sin duda en el mejor fin de curso que he visto EN MI VIDA. #Increible #mencanta,5
"#MeCaeMal todas las viejas rogonas!!! Si no las busca, a la fregada, pelados a las vuelta de la esquina hay y muchos..!!! :P",0
"""@LasFaciles: #MeSaca la gente que se cree Dios. ME DAN GANAS DE ROMPER TODO.""",0
"Mas que un sueño, fue una revelacion... Cteo que quedo bastante claro mi inconsciente.... #miedo",1
"Me recuerda a aquella vez que me presente a un examen de mates sin tener ni puta idea y saque un 1,5.....#Miedo",1
El gurú de la seducción es un machista integral que demuestra la desorientación en la que andamos todos... Y todas #asco,4
"#L6Ncorrupción Me repugna enormemente que hagan política con estos temas, cierto es que si no es de esta manera no sale a luz...#tristeza",2
"le va a sacar foto al dibujo, me lo va a pasar, pero de todas formas va a venir a mi casa a darmelo;-; lo peor es que sabe donde vivo #miedo",1
"Mañana madrugo y en total en todo el finde dormi 8 horas aprox, no doy mas, a dormir ya hasta manana! GRACIAS PEDRO #feliz ♥",3
"Nada más extraordinario que un fin de semana, para descansar y pasarla genial con la familia y los amigos #Feliz sábabdo",3
Después de la publicidad de Icardi no voy a volver a tomar Pepsi nunca jamás. #Asco,4
"Hoy cocina mi hermana dioos , vamo a ver que sale ! #Fe #Miedo.",1
"Esa tranquilidad q se siente cuando te das cuenta q estás en lo cierto,q de serlo todo ya no es nada, q por fin pasó ese capítulo! :) #feliz",3
Que lastima que no jubilen a ciertos profesores del IES San Juan Bosco #asco,4
"Si vas a dar doble #regalo #sorpresa porque hoy es su cumpleaños, hay nuevas bolsas @LaNapolesDF @eje_universidad http://t.co/89jBt0Cnae",5
"#enojopantojo la ponen el caramelito, colaboradora y tal pa que largue y luego patada en la boca cono a la tia de adams @salvameoficial",0
"#MeCaeMal Esos choferes De Transantiago,Micros Talagantinas Que hacen paro para puro ver el partido ! sin cumplir su pega como corresponde!",0
Lo que menos quiero hacer es confundir las cosas :| #Miedo,1
Comienza el partido en la bolera de #Maliaño !!! Puertas Roper a por el liderato!!! #CamargoesDeporte http://t.co/7bolyq0tTM,0
#MeCaeMal el tipo de gente que pública en redes sociales todo lo q hacen; como si nos importará... (ahora me rascare el codo),0
"Desvelada, cn dolor de espalda, a la vez cansada,  cn la cama grande sin cami, viendo cake boss..pero #feliz",3
Ok... escuche un ruido raro D: #Miedo,1
"Iba caminando por la calle, encontre una rata mordiendose con una paloma.. El dia a dia en mi vida es tan normal #ASCO #ZoiEzpezial #SoloAmi",4
"No se pierdan nuestro mini especial esta noche, van a morir de la risa. #MiniEspecial #Sorpresa #EPL",5
"DE JUANA HUIDO Y DISFRUTANDO DE SU MUJER Y RETOÑO, MIENTRAS 998 FAMILIAS LLORAN Y PIDEN JUSTICIA....#ASCO http://t.co/AoASI1lfrB",4
"Caminando en este nuevo año, falta poco para Reyes, con que nos sorprenderán este año los Magos de Oriente? #Sorpresa",5
"dios acabo de ver lo de la araña esa...y yo siendo alergica a las picaduras de los insectos, como me pique me mata... #MIEDO",1
"Comer, ponerte a estudiar, darte cuenta de que necesitas una siesta, dormir 20' y que te despierte Belén Esteban... #Asco",4
"@EresCurioso:Cuando te despiertas en torno a las 2,3am sin ninguna razón, hay una posibilidad de que alguien te está mirando. Me pasa #Miedo",1
"Es increíble como después de una situación vergonzosa, puede pasar a una situación deliciosa y que quiere repetir #Increible #PuraMagia",5
Si los fumadores se sintieran su aliento... no habría fumadores #asco,4
@egraffignano #miedo va a ser cuando veas el contrato.. dormir una noche con el yofo luna jajajajajaajaj,1
Messi ha he hecho una temporada de mierda...pero vamos a hacerle el mejor pagado del mundo como agradecimiento. No sea que se vaya #Miedo,1
Amo amo que el histeriqueo de la conquista. Te hace sentir plena ♥ #feliz,3
#Mérida El @ayto_merida pondrá pantalla gigante en el Parque López de Ayala para seguir el partido @Merida_AD - UP Langreo #NuevasInforma,5
Acaba mi día. Gracias a todos los que os habéis acordado de mí. Los 25 no han hecho más que empezar!! #feliz,3
Pd: saber que puedo ponerme un cancan de bajo del jeans es señal de que aún no engorde los 7kg que acostumbro en el invierno !!! #Feliz,3
"España recibe la cifra récord de 21,4 millones de turistas hasta el mes de mayo #Noticias #Novedades #Madrid

Su... http://t.co/MP4jhcPXZM",5
Merece la pena hacer locuras para pasar días así. #feliz,3
"#gobAbiertoCDMX “@vromog: #LoqueViene en #InnovacionMH es sistema de datos abiertos, internet en espacios públicos http://t.co/lpHNLC93OU",5
@ignaciopetti @santofuegorock @BlayaSF @danioronoSF @gastonlink #miedo dale animal! Se puede ir a ver no? Yo voy!,1
la nueva serie de Sailor Moon va a tener como 24 capítulos no más y los sacarán cada 2 semanas... :/ pa eso esperamos tanto?! #MalaLaWeá,0
"Un centrocampista del barça marcando 3 goles a estas alturas de la liga??? #increible #happy Y Suarez no marcará, pero se sale en cada jugda",5
No hay embole mas grande que aprontar la valija para ir a la capital #OdioLaRutina,0
A pesar de todo lo malo que pueda pasar... Siempre hay algo que te puede hacer sonreir !! #sorpresa http://t.co/ouGMuslpl0,5
"Estos días no he dormido, pero los sueños son los que me mantienen despierta. #feliz Lo que viene pinta bien! Desde ya espero mi recompensa.",3
"odio que me pongan ahi va, che, gas y deme. #Asco",4
"@agustina07hotma che boluda, nunca lali insulto a martina. hasta fue a verla para darle consejos en los shows y su familia la bardea #asco",4
"""@MaryYciz: Mas alivio que obeso dsp de cirugia bariatrica @CataOzta #felizmiercoles"" pasar de la crisis a esto fué único! #feliz #alivio :)",3
@vxtorrelodones http://t.co/cXoDwP6VbP” El PP de Torrelodones en su puro estilo:Mienten y calumnian y luego tu tienes que explicar #asco,4
"Yo ya arranque una nueva vida, una nueva historia y es mejor que las otras! #Feliz",3
"""@elcomerciodigit: Apresan una víbora cerca del parque de Los Pericones en Gijón http://t.co/ZoPjo5zWuI"" ayer corrí por este parque.. #miedo",1
No tenia muchas ganas de armar pero quedaron hermosos!!! #Feliz,3
#cherterenhamed alucinando la diferencia de pasta entre ser olímpico y paraolímpico #increible. @ristomejide @Enhamed,5
Oportunidades como viajar a Bs.As TODO pago y conocer gente copada ..no se dan todos los dias #FELIZ :D,3
Entonces si lo hicimos bien o mal no importa aprendimos la lección... #feliz,3
Juro que llegar a casa dsp del club y que allá olorcito a comida lo valoro tanto como si viviera sola. #gorda #feliz,3
"#MeSaca Las que quieren un novio perfecto y no me refiero a personalidad, no no.",0
"Momentos desagradables y dormir en el medio,y q las 2 personas q tnes al lado esten mirando p/ tu lado con la boca abierta #alientosis #asco",4
Me dice mi novio que habló de su novia periodista de Boca (?) en la facu y que un compañero le dijo que me ubicaba. Ya soy famosa (?) #Miedo,1
"Una de las fobias más grandes que tengo, es a esta criatura... por desgracia me la encuentro frecuentemente #Miedo http://t.co/5hLiTpyrkK",1
Mi late night R&amp;B cuando estoy haciendo trabajos #calma #concentración #estudiando #feliz :) http://t.co/v94idB8GMO,3
@andremarinpuig Ahora si estas de acuerdo con la multipropiedad?! Jajaja que riza das por eso nadie los ve porrista de su fiera #asco,4
Por qué será que en la #oscuridad rodeada de silencio siempre las #lágrimas quieren salir? Será por el #miedo de mostrar nuestra debilidad?,1
"@CorrupLandia Vale que los primeros segundos uno se asuste, pero que salgan corriendo durante un rato? Creen en los zombies, sin duda. #ASCO",4
no se que tan bueno es saber que puedo publciar lo que quiera... sin sufrir las consecuencias :3 hahahah #miedo,1
Mi parcial de Estadística bueno creo que Vicky Xipolitaxis va a tener mejor nota que yo! #miedo,1
"En el ensayito de la comparsa y la verdad, esta es mi cara cuando voy a ir a cantar... 👉😁👈 #PorTusEntrañas #Coac2015 #Increible 🎭😊✌️",5
Bueno de una vez por todas me voy a sentar a estudiar un rato! #gestion #ASCO,4
#NadaMasFeoQue No saber si las cosas que te decía eran de verdad o solo puro chamullo.,0
Ojalá que se haga limpieza en Twitter de los cobardes y gentuza que celebran/aplauden/se ríen de las muertes de otras personas. #asco,4
Se va acercando la fecha y tengo una mezcla de sensaciones que no puedo explicar #Nervios al máximo y #Miedo también,1
"@shul_evolution perdón, pero el #asco no lo dan las señoras madres y señores padres que se los compran a las niñas? Pregunto @CarrefourES",4
Gracias Dios mio x otro a?o Mas de vida #Feliz,3
DREADOUT // Parte 2 - EL GATO: http://t.co/knBErkxgzJ Dos valeintes solos ante el peligro jajajajajaj #humor #miedo en #oviedo,1
Que risa cuando contabamos todas las que nos hablaba y mas jajajajajajajaja #Impresionante,5
"@CamrNovelas ¡Buenos días! Imagino que andaras inmerso en alguna aventura. Felicitarte por tus letras, te noto inspirado #Feliz Besos *_*",3
Esas cosas que te pasan cuando estas de suerte... si asi estoy y asi me siento! #Feliz #CompraConDescuento #PromosLocas,3
Gracias a Dios por darme el mayor de los regalos ser hija y ser madre 🙏 #madre #feliz #hijos #orgullo… http://t.co/hokMTi4ykY,3
Se puedes morir tranquilo que yo a la razón no se la voy a dar :') #MaldadPura,0
Muy lindo fin de semana en familia! Gracias Estudiantes por otra alegría !! Ahora de vuelta a Córdoba para arrancar una nueva semana #feliz,3
Leer las cosas que pusieron estos pibes en wap me dio alto cagaso #Miedo,1
"No hay placer más grande que el de bañarme y meterme en la cama llena de olor a jabón, perfume y crema.. #feliz",3
"Sin palabras, gracias y mil gracias CICLISTA! #Feliz",3
Por qué sí los nombres propios se dicen igual en cualquier idioma los nombres de los países cambian del español al inglés? #fucklogic,0
Un honor perder estado fisico pero no perder la categoría y ser reconocido por eso! #Feliz,3
Un compromiso esto es un pacto en cada acto tienes que tener mucho tacto... #SinFiltro #feliz http://t.co/81uH0qcoA4,3
Viendo lo lenta q es la justicia. ¿pq no se amplian los plazos de las prescripciones? @Psoe @ahorapodemos @UPyD @PPopular @iunida #miedo?,1
"Hoy sí o sí voy al gimnasio, hace una semana que no voyy y encima vengo comiendo de todo. #Asco",4
"@lamascarada Infidelidad seguro q #Asco!ellos con plata se meten en todos lados, cuanta info les venden y ""alterar una muestra es muy fácil",4
#MeCaeMal cierto engendro que me hace la vida de a cuadritos y tengo quw soportarlo por respeto a su madre que es una santa!!!,0
No deberían mandar a curso a esos pendejos q creen saberlo todo e interrumpen a cada rato al instructor con sus ínfulas d grandeza #FUCKYOU,0
"Estas mal.. Muy mal con eso. #Asco ""@Psicovivir: Ok, Hany Kawan me sigue 0,O. debo revisar que cosas estoy escribiendo""",4
¿ Ya vieron las fotos de @nickjonas para la revista Flaunt? #Impresionante cuerpo del cantante http://t.co/p2ctIbLeLj,5
#interesante... La radio no ha muerto: El 79% de los internautas se declara oyente diario:  ... http://t.co/bW3QIOLEFN by @PuroMarketing,5
"#NadaMasFeoQue levantarte,llegar a la escuela y tener que volverte porque no fue nadie!PODÍA HABERME QUEDADO DURMIENDO!",0
"Colegios concertados,hospitales concertados,ciudadanos desconcertados.#Asco.",4
Escuchar hablar en el túnel a @AgustinOrion  como un hincha mas es #increible #VamosBoca,5
Estar d tranqui en casa y que suene el timbre abrir y q sea la loquii de mi antigua compi d trabajo lidia q haya venido a verme :) #sorpresa,5
Trabajar con personas que necesitan ayuda gratuita (: #Feliz #Yadesperté,3
"Jajajja aún me acuerdo del momento ""sonrisa"" y me meo yo sola! Buen intento @ma_garavi ! Mañana más!Jajaja me encantan estos trabajos #Feliz",3
"Qué hacer para que tu #hijo pierda el #miedo a ir al MÉDICO o que nunca llegue a tenerlo  via @abc_es http://t.co/057HjLXNIf 

#Psicología",1
En serio? Media hora para que le hagan valido su cupón de 30% la quiero horcar   #OdioLasCompras #NoSoyMujerNormal,0
"Yo me quedo con la frase que le dijo a Raquel en el Deluxe: ""¿que yo iba a ratos? A ratos vas tú, chocho!!!"" JA JA JA #enojopantojo",0
#BuenosDias Con tan solo media hora de ejercicio aeróbico liberarás endorfinas que te harán sentir #Feliz toooodo el día,3
"Creo q tienen miedo que nos hechen una maldición. Por las dudas ni miro a los gitanos, y agarro bien la cartera. #miedo",1
@OIZuluaga y @AlvaroUribeVel Siguieron con las chuzadas??? ahora todos estamos expuestos ya que ustedes estan contratando Hackers!! #Miedo,1
acepto el amor que me creo merecer y es es que tu me das 😍 gracias por todos tus detalles los amo #sorpresa http://t.co/cX1C4YATzK,5
Volverte a casa estando de fiesta por no tener batería en el Puto móvil empieza a extenderse de manera preocupante por todo el globo #miedo,1
Hice #sushi SOLA!!!! Y aun conservo todos mis dedos !!!!  #feliz http://t.co/k2aItLAH3Y,3
"Al fin en casa,esperando que mañana sea mas largo el dia y alcance hacer todo lo que debo hacer #feliz",3
"@Movilidad_BAQ Es motivo para alegrarse, pero según una noticia la Administración cree recolectar en 2015 altas sumas por comparendos#Triste",2
"#Malificent Ft. Parejita peleandose, La familia parlanchín, El niño cuenta películas, La niña llorona, Los que se equivocan de asiento",0
Un domingo más q especial y triste a la vez..... #Miedo #Angustia,1
Dia inolvidable el de ayer!! Gracias a todas por hacerme esta maravillosa despedida!!! #feliz,3
Lindo? Lindo es saber que Boca viene a Catamarca ! #Feliz,3
"Empizan los examenes hoy, terminan dentro de 14 días. El viernes 30, vuelvo a vivir #ASCO",4
Pasar Toda la Tarde Hablando Contigo  Y Que Me Parezca Solo Minutos .... #Feliz 👌👌👌,3
"De este grupo por mejorar y trabajar son increíbles . Toda esfuerzo tiene su recompensa . #Feliz #Orgullosa ,#Trabajo #benjamines",3
#Noticias #Increíble Video Viral: El poder de un #Lamborghini; este hombre ni siquiera les habla y ellas se suben  http://t.co/kJhSBgehsq,5
"Hermosas fotos de perras vestidas para su boda, que te emocionarán http://t.co/bQaGu5YUuy #impresionante #Seguidores",5
No es miedo a empezar de nuevo es miedo a terminar de la misma manera y volver a caer. #Miedo A enamorarse]#,1
Ahora resulta que los mexicanos nos espantamos de como hablamos... #MalasPalabras que poco nos conocemos... #MochosEspantados,0
Los abogados radicalizan sus protestas y se encierran EN EL COLEGIO DE ABOGADOS. Que será lo siguiente? no llevar corbata? #Miedo,1
Como en horas se le puede agarrar asco y rabia a una persona! #Increible,5
Me ilusioné con que esta vez sí llevarían decenas de miles de personas... pero solo llenaron 2 charters #tristeza,2
"Niños que flipan con los juegos de internet y se ponen en plan ""Toma!"" ""No me das ehhh!"" y cosas así.... #EstaOcurriendo #Miedo(?)",1
Magnifico fin de semana y ahora toca dormiir!! Muy buenas noches #romeriaoff #feliz #buenasnoches,3
Confirmado vamos a correr de invitado el 08/06 en la Formula 4 NG.En La Plata agradecido a Marcos Mercuri por la invitacion #Feliz,3
justo hoy tedas cuenta de cuantas personas te quieren hay que valorar y decirles cuanto los quieres #Feliz #Losamo,3
Voy a llegar re temprano a San martin y esta todo re obscuro todavia #miedo,1
¿Quién será el malnacido que manda a currar a los obreros a mi edificio un día festivo? #Odio,0
Perdon Boca hoy te falle. Pero fui a ver un palio y parece que en la semana si se da todo ok lo tengo! #Feliz,3
"@PhanieUrena estoy de acuerdo contigo, ni un animal en cautiverio, menos causarles daño, ahora tengo un proyecto para él. #sorpresa",5
ver un post de @yerita02  y sentir que debo practicar la coreo #Terror jajajajajaja,1
Graciosa caricatura de ¿Cómo Funciona El Cerebro De Un Hombre? no dejes de verla http://t.co/pfN7Srs91H #impresionante #FolloBackSeguro,5
"@_Alafuga desde luego, y habilidad para darle la vuelta a la tortilla cuando descubres algunas de las mentiras #Increible",5
Cantar con mi viejo una cancion q el cantaba cuando iba a la cancha y 20 años despues la cante yo en la cancha Hoy la cantamos juntos #Feliz,3
ver fotos de algunas personas y dar gracias por que no pasase nada.... jajaja @byMluisa  #miedo #pelitos #abueloendosaños,1
"#MeCaeMal la pibita que pasa siempre por alado mio y me mira con cara de culo , MASS TARADAA ES no la BANCO!!!",0
Paraguayo feo dios mio entró a cagar y seguro ni se limpio porque no hay papel! #asco #feo,4
#NadaMasFeoQue que juegue argentina a la tarde mientras que yo estoy en el colegio,0
Buenas noches! Hoy ha sido un día grande. Soy #Feliz gracias a mi equipo de mi alma #ElcheCf #YoConfio y siempre confiaré.Son de PRIMERA!,3
"#NadaMasFeoQue tratar de dejarte crecer el cabello, ir al salón de belleza y salir como xoloitzcuintle cuando solo pediste despunte",0
Me mande una recontra re metida de pata y ahora me siento la mas basura. Lo peor es que por primera vez tengo esa yeta de pelicula. #triste.,2
"Estar sola en tu casa y que los muebles empiezen a hacer ruido, acercarte que dejen de acerlo, alejarte y que lo vuelvan a hacer.. #MIEDO",1
@jescirio mucha suerte para esta noche jesi y seguramente la vas a romper y vas a dejar a más de uno muy #sorprendido.,5
"Recien votada,  a celebrarlo con un vinito.  Por cierto, en mi barrio voto mayoritario a Vox. #miedo http://t.co/paAeQsKkOc",1
"Salgo en bici, a ver si cuando llegue la Real ha ganado 0-1 en el Bernabéu. #sorpresa #aupareal #carlosv",5
"#RegalosFamosos Marc Anthony le obsequió a JLo unas sandalias bañadas en oro de 18 kilates, valorizadas en 24 mil dólares.",5
"Sumar con los deds, no saberae bien las tablas, confundir el compas con el transportador, y seguir pasando de año #Increible",5
#NadaMasFeoQue Tener ganas de entrar al baño y que estes lejos de casa,0
#interesante... Mr Bean hace de las suyas en los nuevos anuncios publicitarios de Snickers: ... http://t.co/maPTSWaEpO by @PuroMarketing,5
#Increíble! Empresa norteamericana desarrolla una pasta dental para niños con sabor a #chocolate http://t.co/mma4lGsQL5,5
Tanta gente que quiere adoptar y no hay niños en los juzgados. Y si está llena la calle de niños que equivalen a planes. #tristeza,2
Bueno después de una buena noche con amigos.. tranqui en casa y sin pasar frio :) #Feliz,3
La muertede dos zorros de  Groenlandia  para acompañar a una vaca con dos patas ...  #Asco @susanagimenezz,4
"la moda de muchas!!! ser vegetariana,  no es moda, es amor real #rabia #indignación",0
"Tras de ir d culo, cuesta abajo y sin frenos y acabar la temp en caída libre, dicen q el prox año se notará + a Jagoba #Miedo #RealSociedad",1
#NadaMasFeoQue te hagan creer en algo que nunca va a pasar,0
"@Villarruel_clau "". . . la suerte de tener un genio, quiero decir. Ahora, a agradecerle a la mamá, que lo parió acá"" #Genial",5
"Seguiros metiendo mierda en el cuerpo para estar mas fuertotes, que vais a acabar bien... #asco #equipodeinvestigacion",4
Yo no puedo creer que anoche me dormí a la 1:30 y hoy me levante a las 6 solo y sin despertador #Increible,5
"Que bien la paso en azul! Amo venir, toda la onda y la calidez de la gente, me hace sentir tan plena, lejos de los problemas #feliz",3
#NadaMasFeoQue haya gente que a visto a su ídolo mil veces cuando hay otros que no le han visto no de lejos.,0
"Hay que ser muy chico para festejar una clasificación , ni siquiera ganaron esa copa. #Asco",4
@DelCaos @CdteTransitoBog y dónde pongo el denuncio nos tomaron foto para intimidarnos por q les hicimos el reclamo. @PoliciaColombia #miedo,1
#MeSaca que te habla lo mas bien por chat y después te mirar cara a cara y ni bola te dan! -.-,0
"Orgulloso del equipo del cual formo parte, unos huevos, corazon y garra :) #Impresionante #Cracks",5
Los meses siguen y esta historia se va haciendo la más importante de nuestras vidas 😍❤️#sorprendente @pabloromans,5
He sido amiga de gente de la cual ahora mismo me arrepiento #asco,4
"Vale, 38 minutos de #OnceUponATime y todo es súper bonito. Me van a dar un mazazo de los buenos en cualquier momento. #Miedo",1
Paso por la grifo y hay una gorda de las que atiende sentada en el piso limpiando los vidrios y le le veía toda la raya... TODAAAA #Asco,4
"En mi paraíso... con mi Reina. Encima... entro, me agarro a Sus varales y me abrazo a Su manto. #regalosdelavida http://t.co/sX776g5xpi",5
Mira como es el salto de un perro en cámara lenta http://t.co/ioS77rx1Fm #animales #camaras #increible #interesante,5
Ver la foto del cuerpo nuevo de maradona y acabar de cenar no son buena combinacion #asco #desagradable,4
Y el año q viene GRACIAS a la LOMCE habrá menos horas d inglés en los CEIPS BILINGÜES d #Madrid pero las horas d religión INTOCABLES #Asco,4
#NadaMasFeoQue darte cuenta de que en la parejita de aun lado hay un travesti,0
"Y stan l@s q no""sienten""o se""identifican""con su bandera y la selección d su país y sn los 1º q celebran si ganan y critican si pierden #Asco",4
"Puse un video en Youtube, y cuando vi que venía publicidad me arranqué los auriculares como si fueran veneno #MIEDO #CalmateLoca",1
Gracias san martin!! Siempre me haces hiciste y haras bien !! #Feliz,3
#NadaMasFeoQue quieras dormir hasta 3 de la tarde un domingo y te despierten a las 12 tu familia -_-,0
"http://t.co/3jprWgaZwW otro mas !!!! ...quiero ver uno ! este es un mall / la cara de asombro de la gente,como cambian sus caras #Sorpresa !",5
"•Cualquiera me puede hacer sonreír, Pero no cualquiera puede hacerme #Feliz como lo haces Tu.. -… http://t.co/NyYZaxVy1X",3
"Lo malo de los días de solfeo es que acabo muerta mucho antes. Mañana a terminar el tercer repaso,hacer el 4o #Miedo",1
"Y si hay algo que me enferma , es que las negras hagan tanto el papel de ""fumo porro"" #asco",4
