text,label
"#nadamasfeoque posponer esas conversaciones de madrugada que enamoran,solo por que una de las dos tiene que irse a dormir.",0
Soñé tantas veces con entrar a la universidad cuando era más pequeña y que ahora me falte tan poco para entrar es tan irreal #Feliz,3
"Ver fechas, pasajes, departamento #MIEDO",1
#CornuHoroscopo me tiro toda la posta de lo que me esta pasando en este momento #Miedo,1
Mujeres que no se cuidan...el país en una destrucción y Valencia minada de embarazadas....! #susto.,1
"Re lindo hablar de la fiesta con mamá y tener pocas cosas de que ocuparnos, no falta mucho #feliz",3
"#Increible esta seleccion, no hay palabras 13 abajo contra EEUU alucinantes estas chicas #SomosEquipo",5
Listo ! Al fin un tema terminado.. Guardar secretitos siempre me hizo mal ! Jajaja  . Ahora si la pagina she pashoooo!! Re en blanco #feliz,3
"Me enervan los hombres con playeras rojas no camisas, playeras! #asco",4
Estar sola en casa y solo pensar en el cerdo de Saw jajajajaja #miedo @LuciaHernndezz,1
Voy a empezar a pensar un poquito mas en mi...#Feliz http://t.co/A6fF2ifc4A,3
Y en un par de horas se cambia de aguas! Buenas tardes #barcelona #feliz http://t.co/RDMxg6Z7JO,3
#AstraDameTiempo    @amigosdelogin @YoSoyAstrA Se Viene #Sorpresa con @daddy_yankee 😱 Espero saber pronto de que se trata :D ☺,5
@rogerfederer salvó tres pelotas de partido a @stanwawrinka en el tercer set y ahora levanta un 15-40. Lo vemos en @teledeporte. #Increible,5
"""@AraceliZalazar_: Lindo? Lindo es saber que Boca viene a Catamarca ! #Feliz""",3
El bebe de Esmeralda lleva mas de 9 meses en gestación. D: #Miedo #LoQueLaVidaMeRobo  D:,1
"Victor Hugo no te puedo escuchar!!!!! No puede ser, la sarta de pelotudeces que decís al AIRE en la radio. #Increible",5
"La publicidad sigue siendo mazo d machista, o la mujer es un objeto o es la q se encarga d ir al super y limpiar #asco #sociedadmachista",4
"La gente infumable que n entiende que si no respondes 1, 2 veces. No responder mas !!!! #Pesadilla #ASCO!!!!!",4
"Mi primo ya se durmió , ahora me quedé mas que sola en la casa , #miedo #valen",1
Asquerosas fotos de una fabrica de FIDEOS en China http://t.co/uJqF7EDkpk #impresionante #SiguemeYTeSigo,5
"Hoy estuvimos en la Col. COMBATE excelente evento d Madres e Hijos, disfrutaron d música, juegos y Sorpresas #Feliz http://t.co/zmI1yqWDsr",3
Poniendo en práctica  lo k e aprendido viendo a @alexavideorola  en @videorolavr y ya me gane el título d la #MalaMayor jajaj #ahoraSoyMala,0
Eh aquí los chicos que hicieron del 6 de mayo el día mas #FELIZ de mi vida! @onedirection @SonusBand I Love U♥ http://t.co/Tk9EjP6pb1,3
Hoy safe dos veces que no me saquen el celular en el colegio #miedo,1
Cuentame la historia de como el sol amaba tanto a la luna que moría cada noche para dejarla respirar. #Feliz noche http://t.co/p7VEKMqP5I,3
Los mejores regalos que Dios me podia haber dado hoy! #Feliz #FelizCumpleParaMi,3
"Caminando sobre la nieve crea arte, super espectacular http://t.co/fsUlhUIcZl #impresionante #siguemeytesigo",5
"Estuve todo el fin de semana postergando estudiar, hoy voy a ver los resultados #OdioLosLunes",0
Muxisimas gracias si esk como no os voi a querer sois lo mejor os quiero ya os invitare a algo ;) #regalazo @SSilvia00 @Melodysnchez,5
Q buena noticia acabo de recibir!!!#feliz,3
la gran mayoría de los argentinos son iguales bien agrandados #asco,4
No hay nada mejor que estar echa una mierda y que te llame tu novio para ayudarte y hacerte tan feliz como te mereces. #INCREIBLE.,5
@martuniki @Pepenavarretetu no soy muy popular peero prefiero esta no popularidad a decir lo que quieren oir :D #malditodefecto xD,0
"Quién le tiene #miedo a los truenos, nunca ha tocado En una banda de rock #bateristas",1
El mejor jugador del mundo doblete y ahora regala los golitos a los demas pa q cojan moral  #impresionante#CR#jugon#enchufaalguna,5
¿Pero cómo mi madre deja pasar a semejantes individuos en mi casa? #Asco #Ugg #Urticaria #QueMeDa #TeLoJuroQueMeDa,4
"Prendí la tele y oh! #Sorpresa...vino el Papa otra vez!!!....no? Ah! Perdón, me informan que es el cortejo fúnebre de #Chespirito #YaMeCanse",5
Le preguntan a un alcalde si está de acuerdo con la reforma educacional. Dice que no. #sorpresa,5
Como lo voy a pasar hoy en clase uf uf... #Asco,4
"@FranciscoBlavia Puras cosas sorprendente y agradables, Moustakas puede chocar la bola, Butler roba bases y Cain una aspiradora! #Increible",5
Como preparar una deliciosa crema de pimentón para untar http://t.co/2p2CmTELlJ #impresionante #sigueme,5
Nunca suben las selfies en las que salgo. Siempre en las que no estoy o salgo tapada porque nadie me banca :'( #enojada.,0
"Q t pase un ratón x el pie no es nada agradable, gracias kina x salvarme!! #terror #fobia #casiinfarto #llantos #trauma",1
Primera 10mil oficial terminada.... Gracias Rosalía @SOKERA_SB por ser mi compañera de batallas y ayudarme a terminarla!! #Feliz,3
Pues nada noche de tormenta y de dolor de muela ⚡️☔️😁 #BuenosDias #maldormida,0
"Si os encontrais una entrada para ver Godzilla, rompedla para que aunque no vayais vosotros alguién no pase un mal rato. #asco #americanada",4
Y los disfrutas como nunca... Y volverias a repetir ese momento una y mil veces mas. Inolvidable. #Presentacion #Feliz,3
"En el mismo sitio que hace dos años, pero sin mi prima prefe @aurialpresa :_( #MalúSevilla #TourSí",0
"#L6Ndebateuropa ya lo ha dicho la de#Upyd: cuando hay una patología social (nacionalismo) se aplica su medicina, la ley (los palos) #miedo",1
El PP da un nuevo paso totalitalista. Se creen en el derecho de inmiscuirse en la propiedad privada #asco  http://t.co/dEaC7cyQm5,4
¿Crees que porque tu piel luce bien esta bien? Mira este video http://t.co/5Vta9DWWsI #impresionante #Followbackfijo,5
"""Mis amigos me #motivan e inspiran mis enemigos me dan ideas""#Energy a tope! #Feliz día. Y esta noche conciertazo de @_danielmartin_ Grande!",3
#NadaMasFeoQue tener dos horas de historia un lunes !,0
Cosa más asquerosa que la miel no debe existir #Asco,4
"Dormir bien no, no? Buen día, no me puedo volver a dormir... es la quinta vez que me despierto! #malhumor",0
"""@guadvillar: Pocas cosas tan feas como sacarse sangre #miedo"" aguante tortii!!!!! Animo!!! #farfaraway",1
#NadaMasFeoQue tener una lastimadura o que te duela algo y que a toda la gente se le ocurra tocarte justo ahí.,0
@salvameoficial #enojopantoja vaya boca tiene la laura esta mejor d amiga q de enemiga !!,0
Este va a ser mi entretenimiento desde el día 26 de Mayo hasta el 13 de Junio (Esperemos) #Asco #AmorUniversitario http://t.co/0puZXZtA0W,4
"Un verdadero amigo no te deja solo, un verdadero amigo vuelve a donde estas. #Decepcionado #Triste #SadButTrue",2
De verdad que me gusta MUCHISIMO mi nuevo trabajo. Graaaacias a Dios me adapte muy rápido. #Feliz,3
Garrapatas “asesinas” causan terror en Japón http://t.co/EjzlR88lHV #impresionante #Followme,5
Una sonrisa vale mas que mil palabras :) #Feliz http://t.co/jOwGIJrAH6,3
@CristinaValido  @carlosislatener visitando me pareció bien quizás #sorprendida nunca sueles ver a nadie importante en estos sitios,5
"Cristian Campos: España; gran idea, ciudadanos equivocados http://t.co/ZS00yEkvkM #interesante",5
Conoce la primera impresora 3D de resina desarrollada en España #innovación: http://t.co/W8Ira7o7VL,5
Seguimos con los sevillistas que en lugar de celebrar su título intentan hundir a su rival y béticos que no se alegren por sus vecinos #Asco,4
#Insolito #Sorprendente Capturan pez con dientes parecidos a los humanos http://t.co/AiqisT2jUH http://t.co/6EEzAXDX1L,5
"#NadaMasFeoQue mi cara cuando recién me levanto, cual Isaura cagada a palos con una pala",0
Gracias x ser el primero en dedicarme 2 canciones en mi día...#amada #feliz #DiaDeLaMadre #hija 😍😍😙😘,3
"#NadaMasFeoQue tener sueño!!! Pero que las ganas de estar escribiendo pendejadas, no te dejen dormir!!! :P",0
Enserio....madrugar para no ver claro lo que voy a hacer mañana..... #MeCaeMal jaj,0
Levantarme a las 11 y a tener ganas de volver a acostarme jajaja hace tiempo que no dormía hasta tarde #feliz,3
"Tengo una familia unida,padres comprensivos casi perfectos ,tener,hermanas super lindas y amorosas , una hija grandiosa #feliz",3
"ojeras, ojeras, ojeras... pero como amo esto por dios #cansada &amp; #feliz",3
@LuziluSanchez jaajaja bueno yo menos solo lo pensaba jaja es que tambien quiero ir al concierto de slash *-* jajaja y debo elegir #triste,2
que buena confianza me da el equipo ahora el entrenador me va a hacer entrar en el gabinete de alto rendimiento #feliz,3
#MeCaeMal brisa no la puedo ni ver fea cara de tuerca pelo de virulana.,0
"Estoy feliz, totalmente agradecida con la vida y con la maravilla de la naturaleza y con Dios por darme estas grandes oportunidades #Feliz",3
El arbitro es racista por eso no le pita ninguna a favor de Nigeria. #Malisimo,0
#Google simplifica la forma de visualizar y administrar el historial de nuestra cuenta http://t.co/KCXqcNGPl4 #news #novedades #internet,5
Ese momento en el que te das cuenta que la realidad puede ser incluso mejor que los sueños. #Feliz #Veintiséis #doglover,3
Un niño al ver a un musulman por la calle pregunta a su padre si contra esos es con quienes vamos a combatir y el padre dice que si. #Miedo,1
El Salvador no necesita que los corruptos de @ARENAOFICIAL vuelvan llegar al poder. #Asco,4
@1arco te veo con tu pata chula 👣 y me quedo 🙎😱 #QueVieneeeee! Jajajajajaja Esperemos no tener ninguna sorpresa por la mñn 🎁😂 #Miedo,1
"Nada mas feo que el perfume pichi, y el de al lado tiene uno que parece perfumina #Asco",4
Momentos genial son los que he pasado al lado de estas grandes atletas #friends #increible #instalove… http://t.co/AArYa4KOCK,5
"Te presento al tiburón ballena, uno de los más grandes del mundo http://t.co/UsJtwjNNte #interesante #sigueme",5
#MeCaeMal la gente que se piensa que es perfecta como para decir cosas sobre el cuerpo de los demás.,0
"La mejor manera de pasar el fin de semana...AL LADO DE @gcuestm,xq a su lado todo es muxooooo mejor!!!TODOOOOO #increible#cadadia#toxti",5
"""@antonietapanda: @jatirado @jalg_86 @PPopular @PSOE todavia tienen los #ppsoes apoyo d 58%, q lento va esto, q desesperación,  #asco""",4
"A ver, Conspiración, básica, primero se crea un buen relato, antes de realizar una operación, #Sorpresa Pachter.",5
"Jueves 22 a las 18:30 hs. en la facultad d derecho unne x calle Salta 459, me entregan mi título! #Feliz nos vemos ahí @SooleAcosta",3
Eh... ¿Por qué la madre de Katia tiene la misma puta cara que ella? #Miedo,1
"Oh, odio venir  buacar a Milu a la escuela, 8 horas para salir!!!!!! #Fuck",0
La gente que alarmista con que no llamen pal mundial a Arbeloa eso si las coñas de cono y demas ahora no valen? #asco,4
"Que tipo de persona puedes ser?  si te expresas frente a la gente que tu hernana no es soltera, es QUEDADA!! #asco",4
Una pieza bizarra para ver los dientes completos http://t.co/uigfihlqqk #impresionante #Seguidores,5
Nunca mas trepo una reja mojada #asco,4
Gracias farc  por hacer feliz a  @AlvaroUribeVel y ser el mejor baluarte de de la extrema derecha. #tristeza,2
Necesito el teléfono del creador del nivel 86 del Candy Crush para saludarle. Espero que te mueras el día del cumpleaños de tu hijo. #ira,0
Lejos la mejor terapia para la tristeza y el estrés es el deporte!!! #chaolesion #feliz #motivad,3
Unas de las mejores fotos de bodas súper originales (galería) http://t.co/7wQgkEgH7v #impresionante #FolloBackSeguro,5
Cada vez más trabajadores están en riesgo de pobreza pese a tener un sueldo #EspañaAvanza #TerrorismoPatronal http://t.co/kjBVkPF2mf,1
@SergioTM9 no tengp ninguna intencion de estudiarme todo el libro... pero vamos que esta verificado no? #miedo Arriesgamos?? @CharlyRIVS,1
"De vergüenza lo del Barcelona y las pocas entradas que le han dado al Atleti para hoy... Ellos lo llaman #valors, yo #miedo #colchonerox1dia",1
"""@KarehRodrigueez: #NadaMasFeoQue Cuando le pides ayuda a Dios para pasar el semestre  y te contesta esto: http://t.co/wFfRpRZlxG""",0
"@NoticiasMVS Vamos #México Es tiempo de que el #miedo esté del lado de los malos, delincuentes (incluso los de cuello blanco, ""gobernantes"")",1
"#MeCaeMal los profesores que no se ponen a pensar que nosotros tenemos 11 materias mas, no solo la de ellos -.-",0
@IndaGloryKultur Es #Impresionante @MarinaPmusic! Una de las mejores voces que jamás he escuchado y si la unes @Revolut10narys #musicOn,5
Cada Diia Soy Mas #FELIZ :D Ah Su Lado !! &lt;3 http://t.co/Cz1A3nIk82,3
Los ladrones que subieron al colectivo hoy no nos robaron porque venian escapando de otro robo.. #miedo,1
"Hablando de Dios. Compañera de crochet, madre de 4, señorita de 1er grado nos cuenta que alumna le dijo que la odia a ella y a Jesús. #miedo",1
No se porque anunciáis que vais a echar el partido del villa y luego dais esta mierda!! @teledeporte #asco,4
Wow Andrea me pidio el sabado ayudarla con las mas chiquititas para entrenarlas!! Wow me siento importante ah jaja #Feliz :3,3
Maa echa paca tengo una sorpresa te la voy a dar ♫ #Sorpresa #GhettoArcaa,5
"Creatividad algo que me caracteriza, siempre saco algo bueno de todas las ficciones que veo. #Feliz",3
"La #sabia de los pasos perdidos resultó ser una danza tan profunda, que de ella emergió el reflejo de la #sorpresa. #serendipiaenacción",5
"#MeCaeMal Todo weón verde que te queda mirando y que te diga algo. Entiendan, sus weas de piropos incomodan y no tenemos porqué aguantarlo!",0
#NadaMasFeoQue traducir las cosas a lo pocho... meados tranquilos??? http://t.co/7lvmDKaIAl,0
si no me fijo mi casilla de borradores; el tweet que escribi hace 3 horas nunca se ubiera publicado; pobre de mi #malcelu #conlasjustas,0
Mi primo Rodri no me deja jugar y yo le estoy molestando cual niña pequeña pesada que quiere salir al parque. #FuckThePolice,0
Me siento rodeado de las mejores personas del mundo #feliz #gracias a tod@s http://t.co/zVqYdinDoo,3
Quisiera ser niña rica y que mis papas me pagaran un viaje por todo el mundo ): #posmemato #Lloro #MalditaPobreza,0
#mesaca que esten tan pendientes de Power.... tan envidiosos van a ser???,0
Y estos son los momentos en los que me arrepiento de no haber aprovechado mas el tiempo... #miedodepsicologia,1
"Hasta el año pasado las películas de terror me entretenían, no me daban miedo, ahora las evito a toda costa. #Miedo",1
9 en un oral de Historia con Nahuel.. y sin estudiar solo lei algo 10 min antes..#Feliz,3
No entiendo cómo hay gente que le gusta economía o peor aún cómo estudian eso #Asco #Rechazo #Odio,0
Tres de los saltos de agua más altos del mundo http://t.co/pFbQtpqVpg #impresionante #Seguidores,5
En mi casa de emocionan más por el cumple de mi perro que por el mío #increible,5
#MeCaeMal No poder tenerte en frente con una maquina de cortar cabello y poder calvearte. Bandida,0
En serio Jessica de la p. Llorando...noooo se pasan #morbo #abuso #Asco #ninosquemados  no juegen con el dolor de la gente @NoticiasRCN,4
ok vi algo pasar por la ventana muy bajo osea WTF?  #miedo,1
"#MeSaca que me boluden, q me tomen de estupida, q critiquen al Bieber .. Etc we",0
"Leí en La Nación q hacen armas de fuego c impresoras 3D, q disparan y lo peor : que no son detectadas por los scaners. #miedo",1
¿Cómo hacer tus propias Bolas Hurricane facilito para divertirte? http://t.co/71RFlyWXa9 #impresionante #siguemeytesigo,5
"salio campeon la juve,el manchester city solo falta que gane el aleti y me muero trankiloo :') #Feliz",3
Nada más lindo que me digan que voy a ser la madrina de Lauty. #Feliz,3
Genial hoy me di cuenta que me encanta m profesion #contadora #feliz,3
Me gustaría dejar de maquinar y poder dormir como una persona normal. #Miedo,1
Que horror @ADOLFOPEREZL  ya hablando que #URU va a respetar a #COL porque llega con tres victorias a octavos.  #MalditoPueblo. #Brasil2014.,0
Ejemplo de #MACHISMO:Casi uno de cada tres divorcios se debe al síndrome premenstrual de las mujeres  @abc_es http://t.co/BluYXfbQvy #ASCO,4
Q feo q es maxi diorio! X mas pija q tenga como le pueden dar algunas u.u #Asco,4
"Escuchos ruidos de los vecinos, los perros ladran, HAY RUIDOS!!! Xd #miedo",1
@fetcheves acabo de hacerlo con mi mama y tenes razon. Mañana m compro 10 mas y resuelvo el misterio #miedo,1
"""@CuadernosTM: Por primera vez en 15 años d profesión me han llamado advirtiéndome d q tenga mucho cuidado por la calle"" #ASCO #indignación",4
"Hoy empieza una aventura muy especial para el @UCCeares, acaba de salir el primer bus de aficionados a un playoff de ascenso a 2ªB #miedo",1
"#inlove #orgullosa #feliz. Al escritor,compositor,psicologo al amigo al Papa ♥mil exitosss! Mi alma en quilla http://t.co/oMp4FqBo6x",3
Mira que siempre hacen lo mismo... Cuando esta mas interesante anuncios! #Asco,4
"#NadaMasFeoQue Esa gente que dice ""del mundo mundial"" Vallanse a la verga pinches nacos . No es chistoso es naco.",0
Voy en un bus donde un hombre mayor va defendiendo/apoyando lo que dijo este cura... #Asco http://t.co/eJ6wlp1y7x,4
Comida mas incipida que la de hospital no creo que exista... #asco :(,4
Está buena la #guerra publicitaria entre #cablevision y #sky pal #mundial. Lo mejor es que los dos son un #asco,4
#MeSaca tener que explicar las cosas millones de veces porque no entienden,0
#MeCaeMal la gente q no tiene valor para dsirt las cosas en la cara pero tienen valor para hablar a tus espaldas,0
Hoy me desperte preocupada pensando en bañarme y prepararme para trabajar hasta que entendi que tengo franco #Feliz,3
"No aguanto mas a nadie , quiero vivir solaaa . #MalhumorON",0
Gracias Dios! por cada oportunidad que me das... #FELIZ!  :),3
Q #Linda #Sorpresa q me dijo mi #Pastelito estoy totalmente #Feliz ahora mas q nunca mi #Corazón esta completo xq... http://t.co/fb3NspWRZf,5
"Bebé que nació con cuatro brazos y cuatro piernas, se somete a Mayor Operación http://t.co/J7DCFxE3fp #impresionante #siguemeytesigo",5
"Hoy me entregaron mi nota de la prueba del viernes ... 6,8!!! #Feliz!!!",3
#especimen #asco #vergüenza Ahora que me detengan por enaltecer o lo que mierda se les ocurra @revistamongolia http://t.co/QBN2co60on,4
"Me quede sola, este viejo me va a violar #miedo ah",1
oh encima q mi vieja todabia no llego de sanjus mi abuela hizo sopa #Asco #MáAPurate,4
#interesante Un diamante del tamaño de la Tierra - Un equipo de astr&amp;#243;nomos ha detectado la enana blanca m&amp;#... http://t.co/tI4MyfQ8AW,5
"Tengo tantas ganas de hablarte. De saber como estas, como la estas pasando, como te está llendo en ese tan lindo y ansiado viaje :( #triste",2
Aaaah llegue tarde a tomar el tren y viajo sentada #Genial,5
No paro de mirarme la mano. Me queda tan lindo el anillo! Casi muero cuando me lo dio! #feliz #amorporsiempre,3
decirle #Gay a los hombres que cantan sobre el #Amor y que prefiera mil veces el que solo piensa en sexo :o que #Tristeza :/,2
"No esperaba menos... Muere un policia en la calle asesinado, y leo más tweets de gente preocupada por ver quien se lía con quien mhyv.#asco",4
Como una persona en tan pocos días puede lograr algo así ... #Feliz *.*,3
"Y todo esto es una puta muerda enserio necesito gente que me sace la alegría,  y el lunes abrazos #asco",4
"#Interesante ""@bensua: Los datos más relevantes del VI Estudio anual de Mobile Marketing http://t.co/24Vnl43JVz #mobilemarketing""",5
trabes se hace el importante porque dio todas sus entradas de la fiesta de egresados jajajajajajaja #increible,5
"@Crisglpez @Siempree_Racing Se le tendría q caer la cara de verguenza!Q la viesen sus vecinas,los de su trabajo,los del supermercado...#ASCO",4
Una artista transforma dibujos de su hija en obras de arte http://t.co/JNE4V4FouJ #impresionante #sigueme,5
"No quieren derogar la ley, por q es el principal escudo q les dejó PAPA! #Asco #GodoyPelotudo",4
"Es increíble como vuelven las cosas nada + q reflejadas en otras personas todo vuelve a su cause, ver desde la otra perspectiva #Sorprendida",5
Pulsera elegante en plata de ley y una preciosa turquesa #jewelry #joyas #regalo #original #gif #turquesa http://t.co/jZ3aespxLh,5
"6 audios diciendo ""pero que linda"" con distintos tonos de voz #miedo",1
Conoce la primera impresora 3D de resina desarrollada en España #innovación: http://t.co/W8Ira7o7VL,5
#Concludetenidos por qué no hacen allanamientos en la Torre de David como en los campamentos de estudiantes? Qué encontrarían? #Miedo,1
Hacia mucho que no andaba en bici abajo de la lluvia. Pasar por las calles llenas de agua a los palos :3 #Feliz como nene en una jugueteria!,3
#MeSaca q hablen mal de ella sin saber ni su nombre completo http://t.co/vyxkpIZT9q,0
"Después de un año, hoy vuelvo a ver a mis primeros alumnos #feliz http://t.co/68YdaYjBTV",3
"Ciudadanos griegos que trabajan a cambio de comida, es lo que la CEOE llama flexibilidad laboral #TerrorismoPatronal http://t.co/FeeNUokay8",1
Kristian de BCN (nacido en Inglaterra) se ha llevado hoy los 300€ de la #CombinaciónKiss ¡En seguida resolvemos las canciones de #Miedo!,1
Mucha Mini Cooper pero bien que te sacas los mocos en el semáforo.  Con razón no tengo novio. #Asco,4
"Tengo MIEDO a cualquier día,a que sigan sucediendo estos hechos el dolor no importa porque aquí solo importa si eres Rojo Régimen#triste",2
Repitiria una y otra vez esta experiencia. Grande @_danielmartin_ muy grande. Gran concierto. Gran noche. Grandes invitados. #Feliz,3
"""@PauKings1: Buen día!, ya se q no tiene nada de bueno levantarse a las 5 am pero es repaso final! #últimoesfuerzo #miedo"" idem idem",1
Le acabo de confirmar cita al peluquero para cercenarme medio metro de pelo... la forma mas rápida de bajar de peso que encontré. #miedo,1
banda me acaba de dejar seguir pero no entienden que estoy enfermo y no puedo darle a esto #triste,2
"Ojo con lo que dicen, que twitter es el archivo personal de cada uno. #miedo #ARG #Messi siempre!",1
Como soy lo mas me levante con ganas de sorprender a mi novio #Sorpresa:),5
"@pasandovoy @carlosdanoz Disculpe yo a usted no le he insultado,pero un Sr. que le echa la culpa a Homosexuales,me da #asco y punto",4
"DROGOS_COMUNISTAS NO LES BASTÓ ENTERRAR MEMORIA DE SIMÓN BOLIVAR,, AHORA VEN A CHAVEZ COMO UN DIOS... #CDSM #ASCO http://t.co/g4xgxloqZM",4
"El mejor ultimo día del alumno, #feliz, que rico es recibir buenos comentarios!!!:)",3
No existe mayor satisfaccion que darte cuenta que cada dia estas mas convencida de la carrera que estudias #Feliz,3
En un minuto puedo cambiar d actitud y en ese minuto puedo cambiar el dia entero... #Feliz resto del Domingo,3
Dos meses y contando... primero dios muchos mas. #Feliz,3
"Una mierda ver amigos y familiares luchar por una atención digna, 6 meses para q te digan q t trates MEJOR por particular! #SaludCoop #ASCO",4
En el bondi hay una señora que se parece muchisimo a la loca de Expreción corporal  del Danzas.. y es enfermera la mina. #Miedo,1
Si ayer estaba #FELIZ hoy estoy el #TRIPLE aprobé el parcial de #Economia vamos carajo que se puede !!!!!!!!!,3
@LuceroMexico Que crees adorada ya  hace 24 horas que hiciste inmensamente #FELIZ a tu ejército lucereno que te parece??,3
"@lacomarca_rules jojojojo, si no me equivoco cuentas como afiliada, que yo iba a apuntarme a modo troll y me leí las condiciones y #sorpresa",5
Muy buen día el de hoy... largo pero contento xq voy bien con psicofisiologia o eso creo jaja #feliz,3
"@Floremeee jajaj deci que es tarde, sino lo re llamabaa? dale en serio, me quieoro matar y ponerme a llorar al mismo tiempo #Miedo",1
"“@radiolared: Diego Cocca ""vamos a necesitar 2 cilindros""” // hablan de llenar canchas saliendo campeon cada 60 años, #increible",5
"@KioteKiote @SabreDigitala yo jamas me explicare porque tanta lamida de culo al vecino,no pido un hooligan,pero un lameojetes tampoco.#asco",4
I M P R E S I O N A N T E #CuandoDejeDeLlover #increible #emocionada Enhorabuena a todos por el pedazo de curro!!  :),5
Te veo con odio e ira pero luego analizo que no vales la pena el desgaste #ira #bedrum #kiowagordon http://t.co/i6T9LCFNw3,0
Que lindo es verte ganar! Que linda manera de despedir al gringo! Que lindo abrazo el de maxi y heinze! #Feliz #NoPuedoPedirNadaMas,3
Me queje porque me aumentaron el plan de movistar y gane!!! Este mes pago 89 y no 350! #feliz,3
Que plaga la fifa! Cuando un jugador le rompe ma pierna a otro y le deja fuera 9 meses si que no hace nada #FuckingFIFA,0
Hoy comimos caramelos y lo pegamos en la silla y bruno escupía las mentitas por el aire JAJAAJAJJAJA rocío me las ponía en la cabeza #Asco,4
"Cada día tiene su propia sorpresa...que bien puede hacer un ""que tengas un buen día"" #sorpresa #calidezhumana #felicidad",5
@DracoMalfoyAPR aparte el tipo merece un nobel de literatura por la calidad de redacción #asco #ridículo #patético,4
"Los días 9 de cada mes, se han convertido en mis favoritos gracias a èl! TeAmoo :) #gracias #feliz @martinrana http://t.co/6Pi2d1wfJQ",3
"amores, se soprenden de las desgracias de nazarena velez ? se peleo con moria que es macumbera (posta es umbandista) era obveo y mas #miedo",1
"Es necesario decirle que lo amo con toda el alma ?? Nunca fui tan feliz , agradecida de tenerte conmigo, a dormir #feliz",3
"@Priccho el mariguanero Pepe Mujica, presidente de Uruguay dijo q se iba cortar  las uñas, #Asco"" Dejenlo terminar sus días. Petróleo no hay",4
"Buen programa sobre educación en #cuartomilenio. Ya cuando vengan los fantasmas y las fotos raras, tendré que correr a la habitación. #miedo",1
La crisis llego para quedarse.como será q por cad. nacional se pelean dos sexys por un terrible hueso q para mi es  Gay. #triste 😡,2
Mi vida sin Dios es como un shuko sin aguacate; simplemente no tendria sabor... #EnDiosConfio #Miedo  al Fracaso #SiSePuede ...,1
"En esta charla, están hablando de ""actualizar las ciudades"" refiriéndose al software que las gestiona. #miedo",1
